{
  "version": 1,
  "updated": "2026-10-17",
  "stage": { "width": 320, "height": 180 },
  "categories": [
    { "slug": "entrance", "name": "登場・退場", "description": "要素が現れる・消えるときの動き。ページやアプリの第一印象を決めます。", "order": 1 },
    { "slug": "text", "name": "テキスト・数字", "description": "文字や数字に動きをつけて、読ませたいところへ目を導きます。", "order": 2 },
    { "slug": "ui", "name": "UIパーツの動き", "description": "ボタンやスイッチ、通知など、操作の手応えを作る小さな動き。", "order": 3 },
    { "slug": "scroll", "name": "スクロール演出", "description": "スクロールに合わせて要素を見せる、LPやWebサイトの定番演出。", "order": 4 },
    { "slug": "ambient", "name": "背景・雰囲気", "description": "主役を邪魔せずに画面へ奥行きや空気感を足す、背景の動き。", "order": 5 }
  ],
  "items": [
    {
      "id": "001",
      "slug": "pop-in",
      "category": "entrance",
      "name": { "ja": "ポップイン", "en": "Pop-in" },
      "summary": "ポンと弾んで現れる",
      "description": "アプリのアイコンがばねのように少し行き過ぎてから落ち着き、通知バッジが一拍遅れて同じ動きで現れます。",
      "level": "beginner",
      "tech": ["css"],
      "tags": ["登場", "ばね", "アイコン", "バッジ"],
      "featured": true,
      "preview": {
        "html": "<div class=\"pop\"><div class=\"pop__icon\">★</div><div class=\"pop__badge\">1</div></div>",
        "css": ".pop{position:relative;width:96px;height:96px}\n.pop__icon{width:96px;height:96px;border-radius:26px;background:var(--p-color,var(--primary));color:#fff;font-size:44px;display:grid;place-items:center;animation:pop-in var(--p-cycle,2.4s) var(--p-ease,cubic-bezier(.34,1.56,.64,1)) infinite}\n.pop__badge{position:absolute;top:-10px;right:-10px;width:30px;height:30px;border-radius:50%;background:var(--amber);color:#fff;font:700 14px/30px system-ui,sans-serif;text-align:center;animation:pop-in var(--p-cycle,2.4s) var(--p-ease,cubic-bezier(.34,1.56,.64,1)) var(--p-badge-delay,.25s) infinite}\n@keyframes pop-in{0%{transform:scale(0) rotate(-20deg);opacity:0}18%{transform:scale(1) rotate(0);opacity:1}72%{transform:scale(1);opacity:1}86%,100%{transform:scale(0);opacity:0}}",
        "js": ""
      },
      "prompt": {
        "ask": "ロゴをポップインで出して。0.4秒くらいで、少しだけ行き過ぎてから戻る感じに。",
        "spec": [
          "拡大率 0→1 を約0.4秒、行き過ぎのあるイージング（cubic-bezier(.34,1.56,.64,1)）で出す",
          "同時に傾き −20°→0° を戻す",
          "付属のバッジは0.25秒遅らせて同じ動きで出す",
          "退場は縮んで消える（拡大率 1→0、約0.3秒）"
        ],
        "use": "アイコン・ボタン・バッジなど、小さな要素を軽く目立たせて出したいとき。"
      },
      "related": { "prompts": [], "tools": ["cursor", "claude"], "learn": ["learn/development"] },
      "playground": {"params": [{"key": "cycle", "label": "1回の長さ", "type": "range", "min": 1.2, "max": 4, "step": 0.1, "default": 2.4, "unit": "s", "css_var": "--p-cycle", "prompt": "登場から退場までの1周期は{value}"}, {"key": "overshoot", "label": "行き過ぎ", "type": "select", "options": [{"value": "none", "label": "なし", "css": "ease-out"}, {"value": "soft", "label": "少し", "css": "cubic-bezier(.34,1.56,.64,1)"}, {"value": "big", "label": "大きめ", "css": "cubic-bezier(.34,2.2,.64,1)"}], "default": "soft", "css_var": "--p-ease", "prompt": "行き過ぎ（オーバーシュート）は「{value}」"}, {"key": "color", "label": "アイコンの色", "type": "color", "default": "#6e4bff", "css_var": "--p-color"}, {"key": "badge_delay", "label": "バッジの遅れ", "type": "range", "min": 0, "max": 0.8, "step": 0.05, "default": 0.25, "unit": "s", "css_var": "--p-badge-delay", "prompt": "バッジは{value}遅らせて出す"}]},
      "video": null
    },
    {
      "id": "002",
      "slug": "fade-up",
      "category": "entrance",
      "name": { "ja": "フェードアップ", "en": "Fade-up" },
      "summary": "下からふわっと浮かび上がる",
      "description": "カードが少し下の位置から透明→不透明になりながら上がってきて、しばらく止まり、上へ薄れて消えます。",
      "level": "beginner",
      "tech": ["css"],
      "tags": ["登場", "フェード", "カード"],
      "preview": {
        "html": "<article class=\"fu\"><div class=\"fu__img\"></div><div class=\"fu__t\"></div><div class=\"fu__t fu__t--s\"></div></article>",
        "css": ".fu{width:200px;padding:14px;border-radius:14px;background:var(--surface);border:1px solid var(--line);box-shadow:0 10px 30px rgba(0,0,0,.08);animation:fade-up 3s ease-out infinite}\n.fu__img{height:64px;border-radius:10px;background:linear-gradient(135deg,var(--primary),var(--blue))}\n.fu__t{height:10px;margin-top:12px;border-radius:5px;background:var(--line)}\n.fu__t--s{width:60%;margin-top:8px}\n@keyframes fade-up{0%{opacity:0;transform:translateY(24px)}20%,78%{opacity:1;transform:translateY(0)}92%,100%{opacity:0;transform:translateY(-10px)}}",
        "js": ""
      },
      "prompt": {
        "ask": "カードをフェードアップで出して。24px下から0.6秒で、ゆっくり止まる感じ。",
        "spec": [
          "開始位置は24px下、不透明度0",
          "0.6秒で元の位置・不透明度1へ（ease-out）",
          "複数ある場合は1枚ずつ80〜120msずらす",
          "退場は上へ10pxずれながら薄れる"
        ],
        "use": "カード・セクション・見出しなど、ページの中で順番に見せたいもの全般。"
      },
      "related": { "prompts": [], "tools": [], "learn": [] },
      "playground": null,
      "video": null
    },
    {
      "id": "003",
      "slug": "stagger",
      "category": "entrance",
      "name": { "ja": "スタガー", "en": "Stagger" },
      "summary": "1つずつ時間差で現れる",
      "description": "5本のバーが左から順に、少しずつ遅れて伸び上がります。全部そろったあと、まとめて消えて繰り返します。",
      "level": "beginner",
      "tech": ["css"],
      "tags": ["登場", "時間差", "リスト", "グラフ"],
      "preview": {
        "html": "<ul class=\"stg\"><li style=\"--i:0\"></li><li style=\"--i:1\"></li><li style=\"--i:2\"></li><li style=\"--i:3\"></li><li style=\"--i:4\"></li></ul>",
        "css": ".stg{display:flex;align-items:flex-end;gap:12px;height:110px;margin:0;padding:0;list-style:none}\n.stg li{width:28px;height:calc(50px + var(--i) * 14px);border-radius:8px 8px 3px 3px;background:var(--primary);transform-origin:bottom;animation:stg 2.8s cubic-bezier(.22,1,.36,1) calc(var(--i) * 120ms) infinite}\n@keyframes stg{0%{transform:scaleY(0);opacity:0}22%,70%{transform:scaleY(1);opacity:1}82%,100%{transform:scaleY(0);opacity:0}}",
        "js": ""
      },
      "prompt": {
        "ask": "リストの項目をスタガーで出して。1つにつき120msずらして、下から伸びる感じ。",
        "spec": [
          "各項目は transform: scaleY(0)→1、不透明度0→1",
          "項目ごとに animation-delay を 120ms ずつ増やす（CSS変数 --i を使う）",
          "イージングは cubic-bezier(.22,1,.36,1)",
          "項目数が10を超えるときは遅延の上限を決める（例：最大600ms）"
        ],
        "use": "リスト・グラフの棒・カードの並びなど、同じ形のものが複数あるとき。"
      },
      "related": { "prompts": [], "tools": [], "learn": [] },
      "playground": null,
      "video": null
    },
    {
      "id": "004",
      "slug": "mask-reveal",
      "category": "entrance",
      "name": { "ja": "マスクリビール", "en": "Mask reveal" },
      "summary": "帯が通り過ぎた跡に文字が現れる",
      "description": "紫の帯が左から右へ通り抜け、その跡から「OmochiX」の文字が左から順に見えてきます。",
      "level": "intermediate",
      "tech": ["css"],
      "tags": ["登場", "マスク", "見出し", "clip-path"],
      "preview": {
        "html": "<div class=\"mr\"><span class=\"mr__text\">OmochiX</span><span class=\"mr__bar\"></span></div>",
        "css": ".mr{position:relative;padding:8px 12px;overflow:hidden}\n.mr__text{display:block;font:800 44px/1 system-ui,sans-serif;letter-spacing:-.04em;color:var(--text);clip-path:inset(0 100% 0 0);animation:mr-text 3s cubic-bezier(.65,0,.35,1) infinite}\n.mr__bar{position:absolute;inset:0 auto 0 0;width:18px;background:var(--primary);transform:translateX(-30px);animation:mr-bar 3s cubic-bezier(.65,0,.35,1) infinite}\n@keyframes mr-text{0%,8%{clip-path:inset(0 100% 0 0)}40%,80%{clip-path:inset(0 0 0 0)}100%{clip-path:inset(0 100% 0 0)}}\n@keyframes mr-bar{0%,8%{transform:translateX(-30px)}40%{transform:translateX(230px)}41%,100%{transform:translateX(-30px)}}",
        "js": ""
      },
      "prompt": {
        "ask": "見出しをマスクリビールで出して。帯が左から右へ通ったあとに文字が見える感じで、1秒くらい。",
        "spec": [
          "文字は clip-path: inset(0 100% 0 0) → inset(0 0 0 0) で左から現れる",
          "同じタイミングで細い帯（幅18px）が左端から右端へ移動する",
          "所要時間は約1秒、イージングは cubic-bezier(.65,0,.35,1)",
          "帯の色はアクセントカラー、文字色は本文色"
        ],
        "use": "ヒーローの見出しやセクションタイトルを印象的に見せたいとき。"
      },
      "related": { "prompts": ["video-text-to-video-shot-prompts"], "tools": [], "learn": [] },
      "playground": null,
      "video": null
    },
    {
      "id": "005",
      "slug": "typewriter",
      "category": "text",
      "name": { "ja": "タイプライター", "en": "Typewriter" },
      "summary": "1文字ずつ打ち込まれる",
      "description": "「Hello, OmochiX」が1文字ずつ現れ、カーソルが点滅します。打ち終わると少し止まり、また最初から繰り返します。",
      "level": "beginner",
      "tech": ["css"],
      "tags": ["テキスト", "カーソル", "steps"],
      "featured": true,
      "preview": {
        "html": "<p class=\"tw\">Hello, OmochiX</p>",
        "css": ".tw{margin:0;font:600 26px/1.4 ui-monospace,SFMono-Regular,Menlo,monospace;color:var(--text);white-space:nowrap;overflow:hidden;width:14ch;border-right:3px solid var(--primary);animation:tw-type 3.2s steps(14) infinite,tw-caret .7s step-end infinite}\n@keyframes tw-type{0%{width:0}60%,100%{width:14ch}}\n@keyframes tw-caret{50%{border-color:transparent}}",
        "js": ""
      },
      "prompt": {
        "ask": "キャッチコピーをタイプライターで出して。1文字あたり80msくらいで、右端にカーソルを点滅させて。",
        "spec": [
          "等幅フォントで width: 0 → Nch を steps(N) で伸ばす（Nは文字数）",
          "1文字あたり約80ms（14文字なら約1.1秒）",
          "右端に細いボーダーをカーソルとして置き、0.7秒周期で点滅させる",
          "日本語は文字幅が揃わないので、JSで1文字ずつ追加する方式に切り替える"
        ],
        "use": "ヒーローのキャッチコピー、ターミナル風の演出、AIが返事をしている表現。"
      },
      "related": { "prompts": ["video-text-to-video-shot-prompts"], "tools": [], "learn": [] },
      "playground": null,
      "video": null
    },
    {
      "id": "006",
      "slug": "count-up",
      "category": "text",
      "name": { "ja": "カウントアップ", "en": "Count-up" },
      "summary": "数字が0から目標値へ増えていく",
      "description": "0から12,800までの数字が、最初は速く、終わりに近づくほどゆっくり増えて止まります。少し止まってから繰り返します。",
      "level": "intermediate",
      "tech": ["css", "js"],
      "tags": ["数字", "実績", "イージング", "JavaScript"],
      "preview": {
        "html": "<p class=\"cu\"><span class=\"cu__n\" data-target=\"12800\">0</span><span class=\"cu__u\">users</span></p>",